{
  "approved_on": "2026-08-01",
  "b1v2_coverage": {
    "B1v2a": {
      "asset_min": 0.65,
      "global_min": 0.8,
      "session_tercile_min": 0.6
    },
    "B1v2b_B1v2c": {
      "asset_min": 0.5,
      "global_min": 0.7,
      "session_tercile_min": 0.4
    },
    "b2_vs_b0_fallback": false,
    "failure_status": "REVISE_B1V2"
  },
  "b2v2_feature_names": [
    "b2v2_z_log_trade_count",
    "b2v2_z_unique_contract_share",
    "b2v2_z_log_mean_trade_premium",
    "b2v2_z_log_max_trade_premium",
    "b2v2_deviation_call_put_premium_imbalance",
    "b2v2_deviation_execution_side_premium_imbalance",
    "b2v2_z_repeated_contract_premium_share",
    "b2v2_z_strike_concentration",
    "b2v2_z_expiry_concentration"
  ],
  "b2v2_normalization": {
    "forbidden_inputs": [
      "RV30",
      "QLIKE",
      "MODEL_RESIDUAL",
      "OOS_RESULT"
    ],
    "grouping": [
      "asset",
      "new_york_30_minute_band"
    ],
    "history_rule": "PRIOR_SESSIONS_ONLY",
    "history_sessions_max": 60,
    "history_sessions_min": 20,
    "scale_fallback": [
      "MAD_1_4826",
      "IQR_DIV_1_349",
      "PRIOR_ASSET",
      "CONSTANT_ZERO"
    ]
  },
  "estimands": {
    "delta_b1v2": "QLIKE(B0v2)-QLIKE(B1v2a)",
    "delta_b2v2": "QLIKE(B1v2a)-QLIKE(B2v2)",
    "key_secondary": "delta_b1v2",
    "positive_direction": "EXPANDED_INFORMATION_SET_BETTER",
    "primary": "delta_b2v2"
  },
  "feature_design_outcome_blind": true,
  "folds": [
    {
      "fold": 1,
      "test_count": 20,
      "test_dates": [
        "2025-10-28",
        "2025-10-29",
        "2025-10-30",
        "2025-10-31",
        "2025-11-03",
        "2025-11-04",
        "2025-11-05",
        "2025-11-06",
        "2025-11-07",
        "2025-11-10",
        "2025-11-11",
        "2025-11-12",
        "2025-11-13",
        "2025-11-14",
        "2025-11-17",
        "2025-11-18",
        "2025-11-19",
        "2025-11-20",
        "2025-11-21",
        "2025-11-24"
      ],
      "train_count": 60,
      "train_dates": [
        "2025-08-04",
        "2025-08-05",
        "2025-08-06",
        "2025-08-07",
        "2025-08-08",
        "2025-08-11",
        "2025-08-12",
        "2025-08-13",
        "2025-08-14",
        "2025-08-15",
        "2025-08-18",
        "2025-08-19",
        "2025-08-20",
        "2025-08-21",
        "2025-08-22",
        "2025-08-25",
        "2025-08-26",
        "2025-08-27",
        "2025-08-28",
        "2025-08-29",
        "2025-09-02",
        "2025-09-03",
        "2025-09-04",
        "2025-09-05",
        "2025-09-08",
        "2025-09-09",
        "2025-09-10",
        "2025-09-11",
        "2025-09-12",
        "2025-09-15",
        "2025-09-16",
        "2025-09-17",
        "2025-09-18",
        "2025-09-19",
        "2025-09-22",
        "2025-09-23",
        "2025-09-24",
        "2025-09-25",
        "2025-09-26",
        "2025-09-29",
        "2025-09-30",
        "2025-10-01",
        "2025-10-02",
        "2025-10-03",
        "2025-10-06",
        "2025-10-07",
        "2025-10-08",
        "2025-10-09",
        "2025-10-10",
        "2025-10-13",
        "2025-10-14",
        "2025-10-15",
        "2025-10-16",
        "2025-10-17",
        "2025-10-20",
        "2025-10-21",
        "2025-10-22",
        "2025-10-23",
        "2025-10-24",
        "2025-10-27"
      ]
    },
    {
      "fold": 2,
      "test_count": 20,
      "test_dates": [
        "2025-11-25",
        "2025-11-26",
        "2025-11-28",
        "2025-12-01",
        "2025-12-02",
        "2025-12-03",
        "2025-12-04",
        "2025-12-05",
        "2025-12-08",
        "2025-12-09",
        "2025-12-10",
        "2025-12-11",
        "2025-12-12",
        "2025-12-15",
        "2025-12-16",
        "2025-12-17",
        "2025-12-18",
        "2025-12-19",
        "2025-12-22",
        "2025-12-23"
      ],
      "train_count": 80,
      "train_dates": [
        "2025-08-04",
        "2025-08-05",
        "2025-08-06",
        "2025-08-07",
        "2025-08-08",
        "2025-08-11",
        "2025-08-12",
        "2025-08-13",
        "2025-08-14",
        "2025-08-15",
        "2025-08-18",
        "2025-08-19",
        "2025-08-20",
        "2025-08-21",
        "2025-08-22",
        "2025-08-25",
        "2025-08-26",
        "2025-08-27",
        "2025-08-28",
        "2025-08-29",
        "2025-09-02",
        "2025-09-03",
        "2025-09-04",
        "2025-09-05",
        "2025-09-08",
        "2025-09-09",
        "2025-09-10",
        "2025-09-11",
        "2025-09-12",
        "2025-09-15",
        "2025-09-16",
        "2025-09-17",
        "2025-09-18",
        "2025-09-19",
        "2025-09-22",
        "2025-09-23",
        "2025-09-24",
        "2025-09-25",
        "2025-09-26",
        "2025-09-29",
        "2025-09-30",
        "2025-10-01",
        "2025-10-02",
        "2025-10-03",
        "2025-10-06",
        "2025-10-07",
        "2025-10-08",
        "2025-10-09",
        "2025-10-10",
        "2025-10-13",
        "2025-10-14",
        "2025-10-15",
        "2025-10-16",
        "2025-10-17",
        "2025-10-20",
        "2025-10-21",
        "2025-10-22",
        "2025-10-23",
        "2025-10-24",
        "2025-10-27",
        "2025-10-28",
        "2025-10-29",
        "2025-10-30",
        "2025-10-31",
        "2025-11-03",
        "2025-11-04",
        "2025-11-05",
        "2025-11-06",
        "2025-11-07",
        "2025-11-10",
        "2025-11-11",
        "2025-11-12",
        "2025-11-13",
        "2025-11-14",
        "2025-11-17",
        "2025-11-18",
        "2025-11-19",
        "2025-11-20",
        "2025-11-21",
        "2025-11-24"
      ]
    },
    {
      "fold": 3,
      "test_count": 20,
      "test_dates": [
        "2025-12-24",
        "2025-12-26",
        "2025-12-29",
        "2025-12-30",
        "2025-12-31",
        "2026-01-02",
        "2026-01-05",
        "2026-01-06",
        "2026-01-07",
        "2026-01-08",
        "2026-01-09",
        "2026-01-12",
        "2026-01-13",
        "2026-01-14",
        "2026-01-15",
        "2026-01-16",
        "2026-01-20",
        "2026-01-21",
        "2026-01-22",
        "2026-01-23"
      ],
      "train_count": 100,
      "train_dates": [
        "2025-08-04",
        "2025-08-05",
        "2025-08-06",
        "2025-08-07",
        "2025-08-08",
        "2025-08-11",
        "2025-08-12",
        "2025-08-13",
        "2025-08-14",
        "2025-08-15",
        "2025-08-18",
        "2025-08-19",
        "2025-08-20",
        "2025-08-21",
        "2025-08-22",
        "2025-08-25",
        "2025-08-26",
        "2025-08-27",
        "2025-08-28",
        "2025-08-29",
        "2025-09-02",
        "2025-09-03",
        "2025-09-04",
        "2025-09-05",
        "2025-09-08",
        "2025-09-09",
        "2025-09-10",
        "2025-09-11",
        "2025-09-12",
        "2025-09-15",
        "2025-09-16",
        "2025-09-17",
        "2025-09-18",
        "2025-09-19",
        "2025-09-22",
        "2025-09-23",
        "2025-09-24",
        "2025-09-25",
        "2025-09-26",
        "2025-09-29",
        "2025-09-30",
        "2025-10-01",
        "2025-10-02",
        "2025-10-03",
        "2025-10-06",
        "2025-10-07",
        "2025-10-08",
        "2025-10-09",
        "2025-10-10",
        "2025-10-13",
        "2025-10-14",
        "2025-10-15",
        "2025-10-16",
        "2025-10-17",
        "2025-10-20",
        "2025-10-21",
        "2025-10-22",
        "2025-10-23",
        "2025-10-24",
        "2025-10-27",
        "2025-10-28",
        "2025-10-29",
        "2025-10-30",
        "2025-10-31",
        "2025-11-03",
        "2025-11-04",
        "2025-11-05",
        "2025-11-06",
        "2025-11-07",
        "2025-11-10",
        "2025-11-11",
        "2025-11-12",
        "2025-11-13",
        "2025-11-14",
        "2025-11-17",
        "2025-11-18",
        "2025-11-19",
        "2025-11-20",
        "2025-11-21",
        "2025-11-24",
        "2025-11-25",
        "2025-11-26",
        "2025-11-28",
        "2025-12-01",
        "2025-12-02",
        "2025-12-03",
        "2025-12-04",
        "2025-12-05",
        "2025-12-08",
        "2025-12-09",
        "2025-12-10",
        "2025-12-11",
        "2025-12-12",
        "2025-12-15",
        "2025-12-16",
        "2025-12-17",
        "2025-12-18",
        "2025-12-19",
        "2025-12-22",
        "2025-12-23"
      ]
    },
    {
      "fold": 4,
      "test_count": 20,
      "test_dates": [
        "2026-01-26",
        "2026-01-27",
        "2026-01-28",
        "2026-01-29",
        "2026-01-30",
        "2026-02-02",
        "2026-02-03",
        "2026-02-04",
        "2026-02-05",
        "2026-02-06",
        "2026-02-09",
        "2026-02-10",
        "2026-02-11",
        "2026-02-12",
        "2026-02-13",
        "2026-02-17",
        "2026-02-18",
        "2026-02-19",
        "2026-02-20",
        "2026-02-23"
      ],
      "train_count": 120,
      "train_dates": [
        "2025-08-04",
        "2025-08-05",
        "2025-08-06",
        "2025-08-07",
        "2025-08-08",
        "2025-08-11",
        "2025-08-12",
        "2025-08-13",
        "2025-08-14",
        "2025-08-15",
        "2025-08-18",
        "2025-08-19",
        "2025-08-20",
        "2025-08-21",
        "2025-08-22",
        "2025-08-25",
        "2025-08-26",
        "2025-08-27",
        "2025-08-28",
        "2025-08-29",
        "2025-09-02",
        "2025-09-03",
        "2025-09-04",
        "2025-09-05",
        "2025-09-08",
        "2025-09-09",
        "2025-09-10",
        "2025-09-11",
        "2025-09-12",
        "2025-09-15",
        "2025-09-16",
        "2025-09-17",
        "2025-09-18",
        "2025-09-19",
        "2025-09-22",
        "2025-09-23",
        "2025-09-24",
        "2025-09-25",
        "2025-09-26",
        "2025-09-29",
        "2025-09-30",
        "2025-10-01",
        "2025-10-02",